<?xml version="1.0" encoding="UTF-8"?>
<geo:processes xmlns:geo="http://www.geodata.cn/models/geoprocessing" xmlns:xsi="http://www.w3.org/2001/XMLSchema-instance" xsi:schemaLocation="http://www.geodata.cn/models/geoprocessing ../../../../../../models/src/main/resources/conf/schema/geomodel/processingMeta.xsd ">
	<geo:process>
		<geo:id>swamp.cities</geo:id>
		<geo:title>Swamp Cities</geo:title>
		<geo:tags>swamp</geo:tags>
		<geo:inputs>
			<geo:input>
				<geo:id>rise</geo:id>
				<geo:title>Sea level rise</geo:title>
				<geo:describe>Sea level rise</geo:describe>
				<geo:category>double</geo:category>
			</geo:input>
			<geo:input>
				<geo:id>cities</geo:id>
				<geo:title>Cities</geo:title>
				<geo:describe>Cities</geo:describe>
				<geo:category>featureCollection</geo:category>
			</geo:input>
		</geo:inputs>
		<geo:outputs>
			<geo:output>
				<geo:id>swamp</geo:id>
				<geo:title>Swampped cities</geo:title>
				<geo:describe>Swampped cities</geo:describe>
				<geo:category>featureCollection</geo:category>
			</geo:output>
		</geo:outputs>
	</geo:process>
</geo:processes>
